{
  "lane": "codex_implementation",
  "status": "success",
  "baseline_sha": "d3f5e409b65fca9e4d7ceaebe9e340756b5065f1",
  "contract_sha": "382c1b029a028a9fc5a685ed43e5b35c23b9ab43f9594d54115e50cc2c2770fa",
  "changed_files": [
    "src/archiveIncident.js"
  ],
  "test": {
    "command": "npm test",
    "exit_code": 0,
    "summary": "2 tests passed; 0 failed."
  },
  "summary": "Formatted reportedAt in reporterTimeZone before building archiveDay and archivePath."
}
